title,url
Claude Documentation, https://docs.anthropic.com/en/docs/claude-code/overview
Next.js Authentication Guide, https://nextjs.org/docs/pages/building-your-application/authentication
Next.js App Router Authentication Tutorial, https://nextjs.org/learn/dashboard-app/adding-authentication
Auth.js Official Documentation, https://authjs.dev/getting-started
NextAuth.js Documentation, https://next-auth.js.org
NextAuth.js Live Demo, https://next-auth-example.vercel.app/
Clerk Next.js Documentation, https://clerk.com/nextjs-authentication
Clerk Next.js Quickstart, https://clerk.com/docs/quickstarts/nextjs
Supabase Auth with Next.js App Router, https://supabase.com/docs/guides/auth/auth-helpers/nextjs
Auth0 Next.js Guide, https://auth0.com/blog/ultimate-guide-nextjs-authentication-auth0/
Comparing Auth Providers Analysis, https://blog.hyperknot.com/p/comparing-auth-providers
Next.js Auth Libraries 2025 Comparison, https://www.wisp.blog/blog/nextjs-auth-libraries-to-consider-in-2025
NextAuth Discord Provider, https://next-auth.js.org/providers/discord
NextAuth GitHub Provider, https://next-auth.js.org/providers/github
Auth.js Discord Provider, https://authjs.dev/getting-started/providers/discord
JWT Best Practices Next.js 15, https://www.wisp.blog/blog/best-practices-in-implementing-jwt-in-nextjs-15
Next.js Session Management Guide, https://clerk.com/blog/complete-guide-session-management-nextjs
